<?xml version="1.0" encoding="utf-8"?>
<armylist xmlns="http://rpchess.googlecode.com/" xmlns:xsi="http://www.w3.org/2001/XMLSchema-instance" xsi:schemaLocation="http://rpchess.googlecode.com/ RPChess.xsd">
  <army>
    <name>Chaos</name>
    <description>Chaos: the dreadful and evil army of Chaos Lords come from the Chaos Wastes far beyond any civilization. The army includes lots of potent close combat units but is usually few in numbers. Like the army, their foul chaos magic is aimed for destruction and attack, not defense.</description>
    <initiative>4000</initiative>
    <wealth>12</wealth>
    <staff>
      <piece>
        <name>Chaos Lord</name>
        <id>King</id>
        <max>1</max>
        <cost>0</cost>
        <move>2</move>
        <save>2</save>
        <melee>2</melee>
        <specials>
          <special>
            <name>Brave</name>
          </special>
          <special>
            <name>Scary</name>
          </special>
        </specials>
        <description></description>
        <author></author>
        <email></email>
        <license></license>
      </piece>
      <piece>
        <name>Sorcerer</name>
        <id>Queen</id>
        <max>2</max>
        <cost>2</cost>
        <move>2</move>
        <save>3</save>
        <melee>-1</melee>
        <specials>
          <special>
            <name>Contagion</name>
          </special>
          <special>
            <name>Counterspell</name>
          </special>
          <special>
            <name>Dispell</name>
          </special>
          <special>
            <name>Fear</name>
          </special>
          <special>
            <name>Storm</name>
          </special>
          <special>
            <name>Zap!</name>
          </special>
        </specials>
        <description></description>
        <author></author>
        <email></email>
        <license></license>
      </piece>
      <piece>
        <name>Giants</name>
        <id>Rook</id>
        <max>2</max>
        <cost>2</cost>
        <move>2</move>
        <save>2</save>
        <melee>1</melee>
        <specials>
          <special>
            <name>Rocks</name>
          </special>
        </specials>
        <description></description>
        <author></author>
        <email></email>
        <license></license>
      </piece>
      <piece>
        <name>Chaos Bowmen</name>
        <id>Bishop</id>
        <max>4</max>
        <cost>1</cost>
        <move>2</move>
        <save>5</save>
        <melee>0</melee>
        <specials>
          <special>
            <name>Bows(3+)</name>
          </special>
        </specials>
        <description></description>
        <author></author>
        <email></email>
        <license></license>
      </piece>
      <piece>
        <name>Chaos Knights</name>
        <id>Knight</id>
        <max>4</max>
        <cost>2</cost>
        <move>3</move>
        <save>3</save>
        <melee>1</melee>
        <specials>
          <special>
            <name>Assault</name>
          </special>
          <special>
            <name>Brave</name>
          </special>
        </specials>
        <description></description>
        <author></author>
        <email></email>
        <license></license>
      </piece>
      <piece>
        <name>Beastmen</name>
        <id>Pawn</id>
        <max>12</max>
        <cost>1</cost>
        <move>1</move>
        <save>4</save>
        <melee>0</melee>
        <specials>
          <special>
            <name>Plague</name>
          </special>
        </specials>
        <description></description>
        <author></author>
        <email></email>
        <license></license>
      </piece>
    </staff>
    <author></author>
    <email></email>
    <license></license>
  </army>
  <army>
    <name>Dwarves</name>
    <description>
      Slow but tough, all dwarf units are heavily armored and powerful in 
      close combat. Their real weakness is in speed as they have no cavalry 
      and all units are very slow because of their small feet.
    </description>
    <initiative>3000</initiative>
    <wealth>12</wealth>
    <staff>
      <piece>
        <name>WarLord</name>
        <id>King</id>
        <max>1</max>
        <cost>0</cost>
        <move>2</move>
        <save>2</save>
        <melee>2</melee>
        <specials>
          <special>
            <name>Brave</name>
          </special>
          <special>
            <name>Crossbows(3+)</name>
          </special>
        </specials>
        <description></description>
        <author></author>
        <email></email>
        <license></license>
      </piece>
      <piece>
        <name>Rune Lord</name>
        <id>Queen</id>
        <max>1</max>
        <cost>3</cost>
        <move>1</move>
        <save>2</save>
        <melee>2</melee>
        <specials>
          <special>
            <name>Brave</name>
          </special>
          <special>
            <name>Crossbows(3+)</name>
          </special>
          <special>
            <name>Counterspell</name>
          </special>
          <special>
            <name>Dispel</name>
          </special>
          <special>
            <name>Protection</name>
          </special>
          <special>
            <name>Storm</name>
          </special>
        </specials>
        <description></description>
        <author></author>
        <email></email>
        <license></license>
      </piece>
      <piece>
        <name>Catapults</name>
        <id>Rook</id>
        <max>4</max>
        <cost>1</cost>
        <move>0</move>
        <save>3</save>
        <melee>0</melee>
        <specials>
          <special>
            <name>Catapults</name>
          </special>
        </specials>
        <description></description>
        <author></author>
        <email></email>
        <license></license>
      </piece>
      <piece>
        <name>Crosbowers</name>
        <id>Bishop</id>
        <max>4</max>
        <cost>1</cost>
        <move>1</move>
        <save>3</save>
        <melee>0</melee>
        <specials>
          <special>
            <name>Crossows(3+)</name>
          </special>
        </specials>
        <description></description>
        <author></author>
        <email></email>
        <license></license>
      </piece>
      <piece>
        <name></name>
        <id>Knight</id>
        <max>0</max>
        <cost>0</cost>
        <move>0</move>
        <save>0</save>
        <melee>0</melee>
        <specials/>
        <description></description>
        <author></author>
        <email></email>
        <license></license>
      </piece>
      <piece>
        <name>Infantry</name>
        <id>Pawn</id>
        <max>12</max>
        <cost>1</cost>
        <move>1</move>
        <save>3</save>
        <melee>1</melee>
        <specials/>
        <description></description>
        <author></author>
        <email></email>
        <license></license>
      </piece>
    </staff>
    <author></author>
    <email></email>
    <license></license>
  </army>
  <army>
    <name>Elfs</name>
    <description>
      From the deep forest come the race of pointy-eared fellows. Unlike other
      armies their basic infantry are all armed with bows, filling the sky 
      with long arrows. And when the enemy army closes, the excellent cavalry 
      and mighty treemen can stop it in tracks.
    </description>
    <initiative>1000</initiative>
    <wealth>18</wealth>
    <staff>
      <piece>
        <name>General</name>
        <id>King</id>
        <max>1</max>
        <cost>0</cost>
        <move>3</move>
        <save>2</save>
        <melee>1</melee>
        <specials>
          <special>
            <name>Brave</name>
          </special>
          <special>
            <name>Assault</name>
          </special>
        </specials>
        <description></description>
        <author></author>
        <email></email>
        <license></license>
      </piece>
      <piece>
        <name>Wizard</name>
        <id>Queen</id>
        <max>2</max>
        <cost>4</cost>
        <move>3</move>
        <save>3</save>
        <melee>-1</melee>
        <specials>
          <special>
            <name>Assault</name>
          </special>
          <special>
            <name>Counterspell</name>
          </special>
          <special>
            <name>Dispell</name>
          </special>
          <special>
            <name>Fear</name>
          </special>
          <special>
            <name>Heal</name>
          </special>
          <special>
            <name>Protection</name>
          </special>
          <special>
            <name>Zap!</name>
          </special>
        </specials>
        <description></description>
        <author></author>
        <email></email>
        <license></license>
      </piece>
      <piece>
        <name>Treemen</name>
        <id>Rook</id>
        <max>2</max>
        <cost>2</cost>
        <move>1</move>
        <save>2</save>
        <melee>1</melee>
        <specials/>
        <description></description>
        <author></author>
        <email></email>
        <license></license>
      </piece>
      <piece>
        <name>Elite Archers</name>
        <id>Bishop</id>
        <max>4</max>
        <cost>2</cost>
        <move>2</move>
        <save>4</save>
        <melee>0</melee>
        <specials>
          <special>
            <name>Long Bows(2+)</name>
          </special>
        </specials>
        <description></description>
        <author></author>
        <email></email>
        <license></license>
      </piece>
      <piece>
        <name>Cavalry</name>